key,jp,en,ru
phrase405,どうか……私をもらってください。,"Please... take me.","Пожалуйста... возьмите меня."
phrase406,……！,"...!","...!"
phrase407,ああ！　もちろんだ！,"Yes! Of course!","Да! Конечно!"
phrase408,ぱぁっと少年のように笑うアランは,"Alan smiled like a boy, beaming,","Алан широко улыбнулся, как мальчишка,"
phrase409,マリアを両腕で力いっぱい抱きしめた。,"and wrapped Maria in his arms.","и обнял Марию изо всех сил."
phrase410,マリアもまた、アランの大きな体を,"Maria also wrapped her arms around Alan's big body,","Мария тоже обняла его крепкое тело"
phrase411,抱きしめ返す。,"hugging him back.","и прижалась к нему."
phrase412,優しい木漏れ日の中,"In the gentle sunlight,","Под нежными солнечными лучами"
phrase413,二人はずっとずっと抱き合っていた。,"the two of them held each other for a long time.","они долго-долго обнимались."
phrase414,大きな声。,"A loud voice.","Громкий голос."
phrase415,大きな想い。,"Big feelings.","Сильные чувства."
phrase416,でも、本当に,"But really,","Но правда,"
phrase417,自分が受け止めてもいいのだろうか。,"is it okay for me to accept this?","должна ли я принимать это?"
phrase418,これは複数の貴族の家を巻き込む、,"This involves multiple noble families,","Ведь это затрагивает несколько дворянских семей,"
phrase419,ただの『男女の恋』では済まされない代物なのだ。,"and it's not just a simple romance between a man and a woman.","и это не просто роман между мужчиной и женщиной."
phrase420,この恋の先には、まだ子どもの二人には,"Ahead of this love, for the two of them who are still so young,","В этой любви для них двоих, таких юных,"
phrase421,想像もつかないような苦難が,"there are unimaginable","будет множество трудностей,"
phrase422,待ち受けているのだろう。,"hardships awaiting them.","о которых они не могут и подумать."
phrase423,（本当に、いいんですか？）,"(Is this really okay?)","(Правда, всё в порядке?)"
phrase424,けれど――,"But still—","Но всё-таки—"
phrase425,マリアは、メアリとのやりとりを,"Maria remembered","Мария вспомнила."
phrase426,思い出す。,"her conversation with Mary.","свой разговор с Мэри"
phrase427,アランが愛しい。,"I love Alan.","Я люблю Алана."
phrase428,彼を支えたい。,"I want to support him.","Я хочу поддерживать его."
phrase429,――彼の傍にいたい。,"—I want to be by his side.","—Я хочу быть рядом с ним."
phrase430,（ここで私が迷うのは……,"(If I hesitate here...","(Если я сейчас поколеблюсь..."
phrase431,メアリ様への、アラン様への裏切りだ）,"it's a betrayal to both Lady Mary and Prince Alan.)","это будет предательством и для леди Мэри, и для Алана-сама.)"
phrase432,だからマリアは,"That's why Maria","Поэтому Мария"
phrase433,真っ直ぐにアランを見つめ――,"looked straight at Alan—","прямо посмотрела на Алана—"
phrase434,心からの気持ちを込めて、頷いた。,"and, with all her heart, nodded.","и всем сердцем кивнула."
phrase435,きっと、この恋は,"This love surely won't be","Эта любовь, конечно, не будет"
phrase436,幸せなことばかりじゃないだろう。,"filled only with happiness.","состоять только из счастья."
phrase437,もしかしたら苦難の方が,"Maybe there will be more hardships","Может, будет даже больше трудностей,"
phrase438,多いかもしれない。,"than joy.","чем радости."
phrase439,（それでも、私たちは……）,"(But even so, we will...)","(Но, несмотря на это, мы...)"
phrase440,微笑むアランに抱きしめられ、,"As Alan smiled and held her close,","Алан улыбался и обнимал её,"
phrase441,マリアは力いっぱい,"Maria tightly","Мария крепко"
phrase442,彼を抱きしめ返した。,"hugged him back.","обняла его в ответ."
phrase443,優しい木漏れ日の中,"In the gentle sunlight,","Под нежными солнечными лучами"
phrase444,二人は共に歩む未来を誓い合う――。,"they vowed to walk their future together.","они поклялись вместе идти в будущее."
