key,jp,en,ru
name1,マリア,"Maria","Мария"
phrase2,疲れた……。,"I'm exhausted...","Я совсем вымоталась..."
phrase3,マリアは図書室の片隅で机に突っ伏していた。,"Maria was slumped over a desk in the library corner.","Мария лежала лицом на столе в углу библиотеки."
phrase4,期末試験が終わって,"Now that finals are over,","Теперь, когда экзамены закончились,"
phrase5,やっと一段落したと思ったのに……。,"I thought I could finally rest...","я думала, что смогу наконец-то отдохнуть..."
phrase6,マリアが思い出すのは,"Maria's thoughts turned to...","мысли Марии унеслись к..."
phrase7,第四王子アラン・スティアートだ。,"the Fourth Prince, Alan Stuart.","четвёртому принцу — Алану Стюарту."
phrase8,双子の兄であるジオルドだけでなく,"Not just his twin, Geordo,","Не только его близнеца Джордо,"
phrase9,女で平民のマリアにも試験結果が及ばなかったことで,"but also that even Maria, a commoner,","но и то, что даже Мария, простолюдинка,"
phrase10,アランはささくれ立っていた。,"outdid him in the exams, leaving Alan irritated.","превзошла его на экзаменах, что его разозлило."
phrase11,顔を合わせるたびに、キツイこと,"Every time we meet, he says something harsh...","Каждый раз при встрече он говорит что-то резкое..."
phrase12,言われちゃうんだよね……。,"It really hurts...","Это так больно..."
phrase13,しかし、それは悔しさからの言葉であり,"But it's out of frustration,","Но это от разочарования,"
phrase14,カタリナのような悪意をぶつけられているのではない,"not malice, like Katarina's.","а не от злобы, как у Катарины."
phrase15,とはわかっている。,"I get that.","Я это понимаю."
phrase16,自分の存在がアランのストレスになるのなら、,"If I cause Alan stress,","Если моё присутствие вызывает у Алана стресс,"
phrase17,マリアはアランを避けた方がいいと考えていた。,"Maria thought she should avoid him.","Мария решила, что ей лучше избегать его."
phrase18,と、その時だ。,"Just then,","И в этот момент,"
phrase19,図書室の扉が開く音が聞こえ、,"She heard the library door open,","Она услышала, как открылась дверь библиотеки,"
phrase20,マリアはびくっととび起きた。,"and Maria jumped up in surprise.","и Мария резко вздрогнула."
phrase21,本棚の影から入室者を確認すると、,"Peeking from behind the shelf, she saw who entered.","Заглянув из-за книжного шкафа, она увидела вошедшего."
phrase22,不機嫌そうな顔の彼がいた。,"It was him, looking displeased.","Это был он, с недовольным лицом."
phrase23,うう……アラン様だ……。,"Ugh... It's Prince Alan...","Ох... Это Алан-сама..."
phrase24,（どうしよう？）,"(What should I do?)","(Что же мне делать?)"
text25,隠れておこう,"I should hide.","Нужно спрятаться."
text26,そっと出ていこう,"I should quietly leave.","Лучше выйти незаметно."
phrase27,（見つかっちゃったら,"(If he finds me,","(Если он меня увидит,"
phrase28,また何か言われてしまうかも……）,"he might say something harsh again...)","он снова скажет что-то неприятное...)"
phrase29,マリアは本棚の影に身を潜めた。,"Maria hid behind the bookshelf.","Мария спряталась за книжным шкафом."
phrase30,……アランの足音が近づいてくる。,"...Alan's footsteps were approaching.","...Шаги Алана приближались."
phrase31,マリアにとっては、その足音から,"To Maria, those footsteps felt like","Марии казалось, что в этих шагах"
phrase32,彼の不機嫌が伝わってくるようで,"they carried his irritation.","сквозила его раздражённость."
phrase33,バレませんように、と身をすくませる。,"She held her breath, hoping not to be noticed.","Она сжалась, надеясь, что её не заметят."
name34,アラン,"Alan","Алан"
phrase35,……チッ。,"...Tch.","...Черт."
phrase36,本棚を隔ててすれ違うその時,"As they passed on opposite sides of the bookshelf,","Когда они разошлись по разные стороны книжного шкафа,"
phrase37,アランは舌打ちをひとつした。,"Alan clicked his tongue.","Алан недовольно цокнул языком."
phrase38,マリアはびくっと震えるも、幸いにして,"Maria flinched, but thankfully,","Мария вздрогнула, но, к счастью,"
phrase39,アランに見つかっていなかったようだ。,"it seemed Alan hadn't noticed her.","похоже, Алан её не заметил."
phrase40,（アラン様、今日も不機嫌みたい。,"(Prince Alan seems upset again today.","(Алан-сама снова выглядит недовольным."
phrase41,はぁ、見つからなくてよかった……）,"I'm glad he didn't see me...","Фух, как хорошо, что он меня не заметил...)"
phrase42,マリアは安堵の息を吐くと,"Maria sighed in relief,","Мария с облегчением вздохнула,"
phrase43,そのまま本棚に身を隠し,"and continued hiding behind the bookshelf,","и продолжила прятаться за книжным шкафом,"
phrase44,そっと図書室から離脱するのであった。,"quietly slipping out of the library.","тихо выскользнув из библиотеки."
phrase45,（本棚に隠れながら遠回りすれば,"(If I stay hidden behind the bookshelf and take a detour,","(Если я продолжу прятаться за шкафом и пойду в обход,"
phrase46,きっと見つからないよね……）,"I should be able to avoid him...)","он меня точно не заметит...)"
phrase47,マリアは本棚の影に隠れながら,"Maria, hiding behind the bookshelf,","Мария, прячась за книжным шкафом,"
phrase48,図書室の扉を目指す。,"headed for the library door.","направилась к двери библиотеки."
phrase49,遠くからアランの,"From afar, Alan's","Издалека шаги Алана"
phrase50,不機嫌そうな足音が聞こえる。,"irritated footsteps could still be heard.","всё ещё звучали раздражённо."
phrase51,（どうかバレませんように……）,"(Please, don't let him notice me...)","(Пусть он меня не заметит...)"
phrase52,扉はもう目の前。,"The door was right in front of her.","Дверь была прямо перед ней."
phrase53,マリアは音を立てないようにしながら,"Maria opened the door carefully, making no sound.","Мария старалась открыть дверь как можно тише."
phrase54,ゆっくりと扉を開いた。,"She opened the door slowly.","Она медленно открыла дверь."
phrase55,だが、それでも,"But despite her efforts,","Но несмотря на все её старания,"
phrase56,わずかな音が出てしまい――,"a slight noise escaped...","дверь всё же скрипнула..."
phrase57,あ。,"Ah.","Ах."
phrase58,あ。,"Ah.","Ах."
phrase59,アランが振り返ったのと,"As Alan turned around,","В тот момент, когда Алан повернулся,"
phrase60,ちょうどマリアが扉から,"just as Maria was about to step through the door,","как раз когда Мария собиралась выйти за дверь,"
phrase61,出ようとしていたのは同時。,"it happened at the same time.","это произошло одновременно."
phrase62,目が合う二人の声が重なった。,"Their eyes met, and they spoke at the same time.","Их взгляды встретились, и они заговорили одновременно."
phrase63,し、失礼しますっ！,"E-excuse me!","Пр-простите!"
phrase64,マリアはアランから何か言われる前に,"Before Alan could say anything,","Прежде чем Алан успел что-то сказать,"
phrase65,慌てて図書室から脱出するのであった。,"Maria hurried out of the library.","Мария в спешке выбежала из библиотеки."
phrase66,今日も今日とて,"Once again, like every day,","Как и каждый день,"
phrase67,アランと遭遇しないように,"trying to avoid running into Alan,","Мария старалась избегать встреч с Аланом,"
phrase68,こそこそと隠れる日々。,"she kept sneaking around.","и пряталась от него."
phrase69,マリアはキョロキョロしながら,"Maria glanced around nervously","Оглядевшись по сторонам,"
phrase70,中庭を歩いていた。,"as she walked through the courtyard.","Мария направилась к двору."
phrase71,アラン様、この辺りにはいないみたい……。,"It seems Prince Alan isn't around here...","Алан-сама, кажется, здесь нет..."
phrase72,ホッと息を吐く。,"She let out a sigh of relief.","Она облегчённо вздохнула."
phrase73,その時であった。,"It was at that moment.","В этот момент."
phrase74,花垣の向こう側から、バイオリンの,"From beyond the garden hedge, the sound of a violin","Из-за садовой изгороди донеслись звуки скрипки,"
phrase75,美しい旋律が聞こえてくる。,"weaving a beautiful melody.","что сплела прекрасную мелодию."
phrase76,なんて綺麗な音色――。,"What a beautiful sound...","Какой красивый звук..."
phrase77,（誰が演奏しているんだろう？）,"(I wonder who's playing?)","(Интересно, кто играет?)"
phrase78,マリアはそーっと,"Maria quietly","Мария осторожно"
phrase79,花垣から顔をのぞかせた。,"peeked out from behind the hedge.","выглянула из-за изгороди."
phrase80,そこにいたのは……。,"And there she saw...","И кого она увидела..."
phrase81,アラン様……!?,"Prince Alan...?","Алан-сама...!?"
phrase82,――だ、誰だッ!?,"W-who's there!?","К-кто здесь!?"
phrase83,人の気配に,"Sensing someone's presence,","Чувствуя чьё-то присутствие,"
phrase84,演奏を止めたアランが鋭く振り返る。,"Alan stopped playing and sharply turned around.","Алан резко прекратил игру и обернулся."
phrase85,あっ！,"Ah!","Ах!"
phrase86,え、ええと、ごめんなさい……！,"Uh, um, I'm sorry...!","Э-это... простите...!"
phrase87,盗み聞きするつもりはなくて,"I didn't mean to eavesdrop,","Я не хотела подслушивать,"
phrase88,すごく綺麗な音色が聞こえたので……！,"I just heard such a beautiful sound...!","Просто услышала такую красивую мелодию...!"
phrase89,……綺麗な音色？,"...A beautiful sound?","...Красивая мелодия?"
phrase90,アランは顔をしかめた。,"Alan frowned.","Алан нахмурился."
phrase91,まるで忌々しいものを見るように,"As if looking at something unpleasant,","Словно разглядывая что-то раздражающее,"
phrase92,バイオリンに視線を落とす。,"he cast his gaze down at the violin.","он опустил взгляд на скрипку."
phrase93,綺麗なものかよ。,"Beautiful, huh?","Красивая, да?"
phrase94,ジオルドの方がもっと上手いはずだ。,"Geordo is much better than me.","Жиордо намного лучше играет."
phrase95,お前だってそう思ってるんだろ。,"You must think that too, don't you?","Ты ведь тоже так думаешь, да?"
phrase96,そんなことないです！,"That's not true at all!","Это совсем не так!"
phrase97,本当に……素敵な演奏でした。,"It was truly... a wonderful performance.","Это было действительно... прекрасное исполнение."
phrase98,俺はしょせん、二番手以下だ。,"I'm always second place, at best.","Я всегда второй или даже ниже."
phrase99,勉強もバイオリンも、何もかも……。,"Whether it's studies or violin, in everything...","Учёба, скрипка... что угодно..."
phrase100,どれだけ努力したって……。,"No matter how hard I try...","Как бы я ни старался..."
phrase101,追いつけやしないんだ……。,"I'll never catch up...","Я никогда его не догоню..."
phrase102,アランは重く溜息を吐いて背を向けた。,"Alan sighed heavily and turned away.","Алан тяжело вздохнул и отвернулся."
phrase103,アランが抱える悲しい重責を、マリアは察する。,"Maria sensed the heavy burden of sadness Alan carried.","Мария почувствовала тяжесть печали, что нёс Алан."
phrase104,マリアは一歩,"Maria took a step","Мария сделала шаг"
phrase105,アランの背に歩み寄った。,"towards Alan's back.","к спине Алана."
phrase106,アラン様には、アラン様の得意なものや,"Prince Alan, you have your own strengths and","Алан-сама, у вас есть свои сильные стороны,"
phrase107,苦手なものがあるのでしょうから。,"weaknesses, don't you?","и свои слабости, не так ли?"
phrase108,向き不向きがあっても,"It's normal to have things you're good and bad at.","Нормально, что у всех есть свои сильные и слабые стороны."
phrase109,当たり前なのではないでしょうか。,"Isn't that perfectly natural?","Разве это не естественно?"
phrase110,……きっと、全てが完璧な人なんていないんです。,"Surely, there's no such thing as a perfect person.","Ведь идеальных людей не бывает."
phrase111,私も、ジオルド様も、アラン様も……。,"Neither I, nor Prince Geordo, nor you, Prince Alan...","Ни я, ни Жиордо-сама, ни вы, Алан-сама..."
phrase112,誰にだって、何かしらの苦手があって,"Everyone has something they're not good at,","У всех есть что-то, что даётся тяжело,"
phrase113,そして、得意もあるんだと思います。,"and also something they're skilled at.","и что-то, в чём они хороши."
phrase114,だからきっと,"That's why I think,","Поэтому я уверена,"
phrase115,アラン様はアラン様のままでいいんだと,"you should stay just the way you are, Prince Alan.","что Алан-сама должен оставаться собой."
phrase116,私は思いますよ。,"That's what I believe.","Так я думаю."
phrase117,……お前……。,"You...","Ты..."
phrase118,アランが振り返る。,"Alan turned around.","Алан обернулся."
phrase119,まるで叱られた子どものような顔だった。,"His face looked like that of a scolded child.","Его лицо было похоже на лицо провинившегося ребёнка."
phrase120,……本当に、そう思うか？,"...Do you really think that?","...Ты правда так думаешь?"
phrase121,はい、思います。,"Yes, I do.","Да, думаю."
phrase122,……。,"...","..."
phrase123,……そうか。……そうかもな。,"...I see. ...Maybe you're right.","...Понятно. ...Может, ты права."
phrase124,きっとそうです。,"I'm sure of it.","Я в этом уверена."
phrase125,それから、改めて……,"And once again...","И ещё раз..."
phrase126,アラン様の演奏、私は好きですよ！,"I really do like your playing, Prince Alan!","Ваше исполнение мне действительно понравилось, Алан-сама!"
phrase127,とっても素敵でした。,"It was truly wonderful.","Это было действительно прекрасно."
phrase128,また聴かせてほしいです！,"Please let me hear it again!","Пожалуйста, сыграйте ещё раз!"
phrase129,おう。,"Yeah.","Да."
phrase130,…………。,"......","......"
phrase131,……ありがとな。,"...Thank you.","...Спасибо."
phrase132,視線を惑わせ,"Averting his gaze,","Отводя взгляд,"
phrase133,アランはもごもごと呟く。,"Alan mumbled softly.","Алан пробормотал."
phrase134,……俺、酷いこと言ったろ、お前に。,"...I said some harsh things to you, didn't I?","...Я говорил тебе ужасные вещи, не так ли?"
phrase135,八つ当たりしてた。……悪かった。,"I was taking out my frustrations. ...I'm sorry.","Я срывался на тебе... Прости."
phrase136,じゃあ……仲直りしませんか？,"Then... should we make up?","Тогда... давайте помиримся?"
phrase137,仲直りって……どうやって？,"Make up...? How?","Помиримся...? Как?"
phrase138,うーん。,"Hmm.","Хмм."
phrase139,握手、とかですかね？,"How about a handshake?","Может, пожмём друг другу руки?"
phrase140,握手……。,"A handshake...?","Рукопожатие...?"
phrase141,アランは自分の掌を見る。,"Alan looked at his hand.","Алан посмотрел на свою ладонь."
phrase142,それから「ん」とちょっと照れ臭そうに,"Then, a bit shyly, he said 'Hmph'","Затем, немного смутившись, он сказал «Хм»"
phrase143,片手を差し出した。,"and offered his hand.","и протянул руку."
phrase144,マリアはその手を取る。,"Maria took his hand.","Мария взяла его за руку."
phrase145,（大きな手……,"(Such a big hand...","(Такая большая рука..."
phrase146,だけど、子どもみたいな人……）,"But he's just like a child...)","Но он как ребёнок...)"
phrase147,くすっと笑うマリアに、アランは,"As Maria chuckled, Alan","Мария тихонько засмеялась, и Алан"
phrase148,「笑うんじゃない」と恥ずかしそうに,"looked away, embarrassed, saying,","смущённо отвернулся, сказав:"
phrase149,そっぽを向くのであった。,"'Don't laugh.'","«Не смейся»."
phrase150,季節は巡り,"The seasons passed,","Прошли сезоны,"
phrase151,また試験の日がやってきて,"and the day of the exams came again,","и снова настал день экзаменов,"
phrase152,そして、今日やっと終わった。,"and finally, today, it was over.","и наконец, сегодня они закончились."
phrase153,疲れた～……。,"I'm so tired...","Я так устала..."
phrase154,ここ最近は、ずっと勉強漬けだったもの……。,"I've been buried in studies lately...","Я все это время только училась..."
phrase155,あとは試験結果を待つのみだ。,"Now all that's left is to wait for the results.","Теперь осталось только дождаться результатов."
phrase156,解放感はあるが、疲労感も大きい。,"I feel free, but also incredibly tired.","Есть чувство облегчения, но усталость большая."
phrase157,マリアは気分転換のため,"Maria decided to get some fresh air","Чтобы развеяться, Мария решила"
phrase158,中庭へ足をのばしていた。,"and headed to the courtyard.","выйти в сад."
phrase159,……のだが。,"...but,","...но,"
phrase160,お気に入りの木陰には先客がいた。,"someone was already in her favorite spot.","в её любимом месте уже кто-то был."
phrase161,アランが寝転がっていたのだ。,"It was Alan, lying down.","Это был Алан, лежащий под деревом."
phrase162,……。,"...","..."
phrase163,寝てる、のかな……？,"Is he... sleeping?","Он спит...?"
phrase164,（どうしよう？）,"(What should I do?)","(Что же мне делать?)"
text165,寝顔を見守る,"Watch him sleep.","Наблюдать за его спящим лицом."
text166,声をかけてみる,"Try talking to him.","Попробовать заговорить с ним."
phrase167,（アラン様の寝顔なんて,"(Prince Alan's sleeping face...","(Спящее лицо Алана-сама..."
phrase168,なかなか貴重かも……？）,"This is such a rare sight...)","Такое редкое зрелище...)"
phrase169,ちょっとした好奇心から,"Out of curiosity,","Из любопытства"
phrase170,マリアは静かにアランへと近づいて,"Maria quietly approached Alan","Мария осторожно подошла к Алану"
phrase171,その顔をゆっくりと覗き込んだ。,"and slowly looked at his face.","и медленно заглянула ему в лицо."
phrase172,木漏れ日の中、目を閉じた彼の顔は,"In the dappled sunlight, his sleeping face","В пятнах солнечного света его лицо"
phrase173,まるで彫刻と見紛うほどに,"looked as if it had been carved from stone,","было похоже на статую,"
phrase174,凛と整っていた。,"perfectly composed.","очень красивое и спокойное."
phrase175,それでいてどこかあどけなくて,"And yet, there was a certain innocence to it.","Но в нём было что-то детское."
phrase176,愛おしさが込み上げてくる。,"A feeling of tenderness swelled up inside her.","Её переполнило чувство нежности."
phrase177,（……綺麗……）,"(...So beautiful...)","(...Какой красивый...)"
phrase178,マリアはそんな感想を抱くと同時に,"As Maria thought this,","Подумав это,"
phrase179,今、彼のこの顔を見ているのは自分だけなのだ、,"she realized she was the only one seeing him like this right now,","она поняла, что сейчас только она может видеть его таким,"
phrase180,という幸福感で少しだけ頬が緩んだ。,"and a slight smile of happiness crossed her face.","и её лицо осветилось лёгкой улыбкой от этого счастья."
phrase181,ふふ。,"Hehe.","Хех."
phrase182,と、その時だ。,"Just then,","И в этот момент,"
phrase183,アランの目がパチリと開く。,"Alan's eyes suddenly opened.","Глаза Алана неожиданно открылись."
phrase184,……おい。,"...Hey.","...Эй."
phrase185,あ……ごめんなさい。,"Ah... I'm sorry.","Ах... Простите."
phrase186,起こしちゃいました……？,"Did I wake you...?","Я разбудила вас...?"
phrase187,……足音で気づいていた。,"...I heard your footsteps.","...Я услышал твои шаги."
phrase188,起きてらっしゃったのですね……。,"So you were already awake...","Значит, вы уже не спали..."
phrase189,彼の顔を覗き込んで、,"Looking at his face,","Заглядывая ему в лицо,"
phrase190,自分はだらしない顔をして,"she wondered if she had made an awkward face","она подумала, не выглядела ли она глупо,"
phrase191,しまっていたのではないだろうか……。,"while doing it...","глядя на него..."
phrase192,そんな恥ずかしい気持ちに,"Feeling embarrassed,","От этих смущающих мыслей"
phrase193,マリアは頬が熱くなった。,"Maria's cheeks grew warm.","щеки Марии вспыхнули."
phrase194,アランはそんなマリアに対し、,"Alan looked at the blushing Maria,","Алан посмотрел на краснеющую Марию"
phrase195,（寝てるのかな……。,"(Is he sleeping...?","(Он спит...?"
phrase196,起こしちゃうのは悪いかな……）,"It'd be bad to wake him, right?)","Нехорошо будет его разбудить?)"
phrase197,（でも、せっかくだし、アラン様と,"(But still, I'd like to talk to him...","(Но всё-таки, я хотела бы поговорить с ним..."
phrase198,少しだけ、お話ししたいな……）,"even just a little bit...)","хоть немного...)"
phrase199,アラン様ー……？,"Prince Alan...?","Алан-сама...?"
phrase200,少しためらいながら、マリアは,"Hesitantly, Maria","Немного колеблясь, Мария"
