key,jp,en,ru
phrase201,控えめな声量で呼びかけてみた。,"called out to him quietly.","осторожно позвала его."
phrase202,……。,"...","..."
phrase203,アランからの返事はない。,"There was no response from Alan.","Ответа от Алана не последовало."
phrase204,（やっぱり寝てる……。,"(So he really is asleep...","(Он всё-таки спит..."
phrase205,アラン様も、試験で忙しかったのかな）,"Maybe he's tired from the exams too...)","Наверное, он тоже устал от экзаменов...)"
phrase206,と、その時だ。,"And at that moment,","И в этот момент"
phrase207,アランの目がパチリと開く。,"Alan's eyes suddenly opened.","глаза Алана неожиданно открылись."
phrase208,……おい。,"...Hey.","...Эй."
phrase209,あ……ごめんなさい。,"Ah... I'm sorry.","Ах... Простите."
phrase210,起こしちゃいました……？,"Did I wake you...?","Я разбудила вас...?"
phrase211,呼ぶのは一回だけか？　俺の名前。,"Is calling my name once enough for you?","Ты думаешь, один раз позвать меня достаточно?"
phrase212,えっ――,"Huh—","Что—"
phrase213,（あ、最初から起きて……）,"(Ah, so he was awake the whole time...)","(Ах, так он всё время был не спящим...)"
phrase214,からかうように細められた,"He narrowed his eyes teasingly,","Он прищурился, будто поддразнивая её,"
phrase215,アランの眼差しに捉えられ、,"and caught Maria in his gaze.","и поймал Марию взглядом."
phrase216,マリアは頬が熱くなった。,"Maria's cheeks grew hot.","Щёки Марии вспыхнули."
phrase217,ア……アラン様。,"P-Prince Alan.","А... Алан-сама."
phrase218,おはよう、ござい、ます……。,"G-good morning...","Д-доброе утро..."
phrase219,おう。,"Yeah.","Да."
phrase220,しどろもどろにうつむいたマリアに,"Seeing Maria looking down in embarrassment,","Увидев, как Мария смущённо опустила взгляд,"
phrase221,アランは小さく含み笑った。,"Alan let out a small laugh.","Алан слегка усмехнулся."
phrase222,……こっちに来い。,"...Come here.","...Иди сюда."
phrase223,アランが手招きをする。,"Alan motioned for her to come closer.","Алан поманил её рукой."
phrase224,マリアが傍に寄れば,"When Maria approached,","Когда Мария подошла,"
phrase225,「座れ」と彼は自分の傍を示した。,"he patted the ground beside him and said, 'Sit.'","он указал на место рядом с собой и сказал: «Садись»."
phrase226,もっと近くに寄れ。,"Come closer.","Подойди ближе."
phrase227,（もしかして、アラン様……,"(Could it be that Prince Alan...","(Может быть, Алан-сама..."
phrase228,膝枕、してほしい……のかな？）,"wants me to give him a lap pillow?)","хочет, чтобы я сделала ему колени подушкой?)"
phrase229,そう考えながら言われたとおりにすると,"Thinking that, she did as she was told,","Подумав так, она сделала, как было сказано,"
phrase230,予想どおり、アランはマリアの足の上に,"and as she expected, Alan","и, как она ожидала, Алан"
phrase231,のしり、と頭を乗せてきた。,"rested his head on her lap.","уложил голову ей на колени."
phrase232,横を向いてマリアの方を見ないのは,"He turned his head away, not looking at Maria,","Он отвернулся, не глядя на Марию,"
phrase233,甘えたい気持ちと恥ずかしい気持ちが,"as if torn between wanting comfort","словно разрываясь между желанием заботы"
phrase234,せめぎあっているからだろうか。,"and feeling embarrassed.","и чувством смущения."
phrase235,かわいらしい様子に,"Seeing this cute side of him,","Наблюдая за этим его милым поведением,"
phrase236,マリアは口元がちょっと緩んでしまう。,"Maria couldn't help but smile.","Мария невольно улыбнулась."
phrase237,試験、どうだった？,"How were the exams?","Как прошли экзамены?"
phrase238,あ、ええと……,"Ah, um...","Э-э..."
phrase239,悪くない手応えかな、って感じです。,"I think I did pretty well.","Кажется, я справилась неплохо."
phrase240,アラン様は？,"And you, Prince Alan?","А вы, Алан-сама?"
phrase241,まあ、それなりに。,"Well, I did okay.","Ну, нормально."
phrase242,そうですか。,"I see.","Понятно."
phrase243,お疲れ様でした。,"Good job.","Вы хорошо потрудились."
phrase244,他愛もない会話だ。,"It was a simple conversation.","Это был обычный разговор."
phrase245,話題が途切れると,"When the conversation ended,","Когда разговор иссяк,"
phrase246,少しだけ沈黙が流れる。,"a brief silence fell between them.","между ними воцарилось молчание."
phrase247,優しい風がそよそよと吹いて,"A gentle breeze blew softly,","Нежный ветерок тихо дул,"
phrase248,木漏れ日が柔らかく瞬いた。,"and the sunlight flickered through the leaves.","и солнечный свет мягко пробивался сквозь листья."
phrase249,お前のおかげなんだ。,"It's all thanks to you.","Это всё благодаря тебе."
phrase250,唐突に、アランが口を開く。,"Alan suddenly spoke.","Неожиданно заговорил Алан."
phrase251,お前と出会ったことで……,"Ever since I met you...","С тех пор, как я встретил тебя..."
phrase252,俺は、背負ってた重いものを,"I've been able to let go of the heavy burdens","я смог сбросить тяжёлую ношу,"
phrase253,下ろすことができた。,"I was carrying.","которую нёс."
phrase254,前しか向いちゃダメなんだと,"I always thought I had to keep looking forward,","Я всегда думал, что должен только двигаться вперёд,"
phrase255,ずっと思ってた俺に……,"but you taught me","но ты научила меня,"
phrase256,力を抜いていいことを教えてくれた。,"that it's okay to relax sometimes.","что иногда можно расслабиться."
phrase257,努力すること、真面目に取り組むこと。,"To work hard, to take things seriously.","Стараться, серьёзно относиться к делу."
phrase258,勉強もバイオリンも――,"Whether it was studying or playing the violin—","Учёба, игра на скрипке—"
phrase259,どうせダメなんだって諦めてたそれらに,"I had given up on them, thinking I'd never be good,","Я уже смирился с тем, что мне не удастся добиться успеха,"
phrase260,正面から向き合えるようになったのは,"but now I can face them head-on,","но теперь я могу смотреть на это иначе,"
phrase261,全部……お前のおかげだ。,"and it's all thanks to you.","и всё это благодаря тебе."
phrase262,アラン様……。,"Prince Alan...","Алан-сама..."
phrase263,マリアと会ってから,"Ever since I met you, Maria,","С тех пор, как я встретил тебя, Мария,"
phrase264,俺の日々が変わったんだ。,"my days have changed.","моя жизнь изменилась."
phrase265,明るくて、眩しくて、大切で……。,"They're brighter, more meaningful, precious...","Они стали светлее, важнее, более ценными..."
phrase266,誰かとの優劣にすがるんじゃなくて,"Instead of comparing myself to others,","Вместо того, чтобы сравнивать себя с другими,"
phrase267,自分のままでいていいんだ、って。,"I learned that I can just be myself.","я понял, что могу оставаться самим собой."
phrase268,そうお前に教えてもらって、,"That's what you taught me,","Ты научила меня этому,"
phrase269,……嬉しかったんだ、すごく。,"and it made me so happy.","и это сделало меня очень счастливым."
phrase270,マリア。,"Maria.","Мария."
phrase271,……ありがとな。,"...Thank you.","...Спасибо."
phrase272,どういたしまして、アラン様。,"You're welcome, Prince Alan.","Пожалуйста, Алан-сама."
phrase273,マリアはアランの額を優しく撫でた。,"Maria gently stroked Alan's forehead.","Мария нежно погладила Алана по лбу."
phrase274,――きっと、これまでアランは,"Surely, Alan had never had anyone","Наверное, до сих пор у Алана никогда не было того,"
phrase275,頭を撫でて褒めてくれる手を,"who would stroke his head and praise him,","кто бы погладил его по голове и похвалил его,"
phrase276,求めても得られなかったのだろうと思いながら。,"no matter how much he yearned for it.","как бы сильно он этого ни хотел."
phrase277,（ひょっとして、アラン様は……,"(Could it be that Prince Alan...","(Может быть, Алан-сама..."
phrase278,私と話をするために、ここにいたのかな）,"was waiting here just to talk to me?)","ждал здесь только для того, чтобы поговорить со мной?)"
phrase279,（……なんて）,"(...No, that can't be.)","(...Нет, не может быть.)"
phrase280,穏やかで静かなひとときが過ぎる。,"A peaceful, quiet moment passed.","Прошёл спокойный, тихий момент."
phrase281,しかし、静寂を破ったのは,"But it was Alan who broke the silence.","Но тишину нарушил Алан."
phrase282,やはりアランからだった。,"Of course, it had to be Alan.","Конечно, это был Алан."
phrase283,彼はパッと跳ね起きると,"He suddenly jumped up","Он резко вскочил"
phrase284,意を決したかのようにこう言った。,"and, as if making a decision, said,","и, будто приняв решение, сказал:"
phrase285,伝えたいことがある。,"There's something I want to tell you.","Я хочу тебе кое-что сказать."
phrase286,だが、その前に俺は,"But before that,","Но перед этим"
phrase287,やらなきゃいけないことがある。,"there's something I need to do.","я должен кое-что сделать."
phrase288,……だからまた明日,"...So tomorrow,","...Так что завтра"
phrase289,今日と同じ時間に、ここに来い。,"come here at the same time as today.","приходи сюда в это же время."
phrase290,そう言って,"Saying that,","Сказав это,"
phrase291,アランは「絶対だぞ」と念押しをして,"Alan emphasized, 'You better be there,'","Алан добавил: «Ты обязательно должна прийти»,"
phrase292,どこかへと駆けて行った。,"and ran off somewhere.","и побежал куда-то."
phrase293,マリアはアランとの約束を思い出しながら,"Remembering her promise with Alan,","Вспоминая обещание, данное Алану,"
phrase294,中庭への道を歩いていた。,"Maria walked to the courtyard.","Мария направилась к саду."
phrase295,しかし、その道を塞ぐように立つ人影がある。,"But someone was blocking her path.","Но кто-то преградил ей путь."
phrase296,その正体は――,"And that person was—","Этим человеком была—"
name297,メアリ,"Mary","Мэри"
phrase298,こんにちは、マリアさん。,"Hello, Maria.","Здравствуйте, Мария."
phrase299,アランの婚約者であるメアリだった。,"It was Mary, Alan's fiancée.","Это была Мэри, невеста Алана."
phrase300,マリアさん。,"Maria.","Мария."
phrase301,あなたにひとつだけ,"I have just one thing","У меня к вам только один"
phrase302,たずねたいことがございます。,"I want to ask you.","вопрос."
phrase303,メアリの眼差しは真っ直ぐで,"Mary's gaze was direct,","Взгляд Мэри был прямым,"
phrase304,凛として真剣だった。,"dignified, and serious.","величественным и серьёзным."
phrase305,マリアは表情を引き締めて,"Maria straightened her expression","Мария подобрала лицо"
phrase306,彼女の言葉を促した。,"and encouraged her to speak.","и подала знак продолжить."
phrase307,――あなたにとって,"—To you,","—Для вас,"
phrase308,アラン様とはどういう存在ですか？,"what kind of person is Prince Alan?","кем является Алан-сама?"
phrase309,私にとって、ですか？,"To me?","Для меня?"
phrase310,マリアは少しだけ考えると,"Maria thought for a moment,","Мария задумалась на мгновение,"
phrase311,メアリの目を見すえ、しっかりと語り始めた。,"then looked into Mary's eyes and began to speak firmly.","затем посмотрела в глаза Мэри и начала уверенно говорить."
phrase312,強がりで、意地っ張りで,"He's stubborn, proud,","Он упрямый, гордый,"
phrase313,でも素直で頑張り屋で優しくて,"but honest, hardworking, and kind.","но честный, трудолюбивый и добрый."
phrase314,……本当は誰よりも等身大な人。,"...More than anyone, he's true to himself.","...Больше всех он настоящ."
phrase315,そんな彼を、愛しいと……,"And I... love that about him.","И это вызывает у меня... любовь к нему."
phrase316,支えたいと、思います。,"I want to support him.","Я хочу поддерживать его."
phrase317,そんな彼の近くに……。,"I want to be close to him...","Я хочу быть рядом с ним..."
phrase318,ずっと、お傍にいたいです。,"I want to be by his side forever.","Я хочу быть рядом с ним всегда."
phrase319,第四王子だから,"Not because he's the Fourth Prince,","Не потому, что он четвёртый принц,"
phrase320,スティアート家だから、じゃない――,"or because he's from the Stuart family—","или потому, что он из семьи Стюарт—"
phrase321,アラン様、だからです。,"But because he's Prince Alan.","А потому, что он Алан-сама."
phrase322,私はずっと、彼と一緒にいたい。,"I just want to be with him.","Я просто хочу быть с ним."
phrase323,傍にいて、彼の笑顔を見ていたい。,"I want to be by his side and see him smile.","Я хочу быть рядом с ним и видеть его улыбку."
phrase324,彼を支えて、彼と共に歩いていきたい。,"I want to support him and walk by his side.","Я хочу поддерживать его и идти с ним бок о бок."
phrase325,……心から、そう思っています。,"...That's how I truly feel.","...Так я чувствую всем сердцем."
phrase326,罪悪感がない、と言えば嘘になる。,"I'd be lying if I said I didn't feel guilty.","Было бы ложью сказать, что я не чувствую вины."
phrase327,メアリはアランの婚約者。,"Mary is Alan's fiancée.","Мэри — невеста Алана."
phrase328,今の言葉は、婚約者に対し,"What I just said...","То, что я только что сказала..."
phrase329,真っ向から相手を奪うと,"is like declaring","будто бы заявляет,"
phrase330,宣言しているようなものだった。,"that I'm stealing him from her.","что я у неё его отнимаю."
phrase331,だけど、今この時は,"But at this moment,","Но сейчас,"
phrase332,本当の気持ちを伝えねば,"I had to speak my true feelings,","я должна была рассказать о своих настоящих чувствах,"
phrase333,メアリに不敬だと、マリアは感じた。,"or it would be disrespectful to Mary.","иначе это было бы неуважением к Мэри."
phrase334,……。,"...","..."
phrase335,メアリはじっと,"Mary listened intently","Мэри внимательно слушала,"
phrase336,マリアの言葉を聴いていた。,"to what Maria was saying.","что говорила Мария."
phrase337,だが、その表情が,"But her expression","Но её выражение лица"
phrase338,ふっとほころぶ。,"softened slightly.","немного смягчилось."
phrase339,……敵いませんね、あなたには。,"...I can't compete with you.","...Я не могу с вами соперничать."
phrase340,メアリ様……。,"Lady Mary...","Леди Мэри..."
phrase341,私には、あの方にあんな笑顔を,"I was never able to bring","Я никогда не могла вызвать"
phrase342,浮かべさせることはできなかった。,"such a smile to his face.","такую улыбку на его лице."
phrase343,あの方の人生を本当に照らせるのは――,"The only one who can truly brighten his life is—","Только одна может действительно осветить его жизнь —"
phrase344,マリアさん、あなただけなんですね。,"Maria, it's you and only you.","Мария, это только вы."
phrase345,あなたの、アラン様へのその気持ち……,"Your feelings for Prince Alan...","Ваши чувства к Алану-сама..."
phrase346,どうか大切になさってください。,"Please cherish them.","Пожалуйста, дорожите ими."
phrase347,では、ごきげんよう。,"Well then, goodbye.","Ну что ж, до свидания."
phrase348,……どうか、お幸せに。,"...Please, be happy.","...Будьте счастливы."
phrase349,浮かべたメアリの笑みは柔らかくて。,"Mary's smile was soft and gentle.","Улыбка Мэри была мягкой и доброй."
phrase350,だけど――きびすを返すその瞬間。,"But the moment she turned away—","Но в тот момент, когда она повернулась—"
phrase351,あっ……。,"Ah...","Ах..."
phrase352,マリアは、彼女の目に,"Maria saw tears glistening","Мария увидела слёзы, блестящие"
phrase353,涙が煌いているのを、確かに見た。,"in Mary's eyes.","в глазах Мэри."
phrase354,メアリ様……ありがとうございます。,"Lady Mary... thank you.","Леди Мэри... спасибо."
phrase355,マリアは彼女の背が見えなくなるまで,"Maria bowed deeply","Мария кланялась,"
phrase356,深々とお辞儀をしていた。,"until she could no longer see her.","пока её фигура не исчезла из виду."
phrase357,約束の場所。,"The promised place.","Место встречи."
phrase358,木漏れ日の下。,"Under the dappled sunlight.","Под пятнами солнечного света."
phrase359,マリアが空を見上げていると,"As Maria looked up at the sky,","Когда Мария смотрела на небо,"
phrase360,一つの足音がやってくる。,"she heard the sound of footsteps approaching.","она услышала приближающиеся шаги."
phrase361,アラン様！,"Prince Alan!","Алан-сама!"
phrase362,ずっと走ってきたのだろう。,"He must have been running the whole way.","Он, должно быть, всё это время бежал."
phrase363,アランは息を弾ませてマリアの傍で立ち止まる。,"Alan stopped beside Maria, out of breath.","Алан остановился рядом с Марией, тяжело дыша."
phrase364,そのまま息を整えて……,"He took a moment to catch his breath...","Он отдышался..."
phrase365,深呼吸の後、アランは背筋を伸ばして,"After a deep breath, Alan stood up straight","После глубокого вдоха Алан выпрямился"
phrase366,マリアの手を取った。,"and took Maria's hand.","и взял Марию за руку."
phrase367,そして、マリアに伝えたいことを,"Then, what he wanted to tell Maria,","Затем то, что он хотел сказать Марии,"
phrase368,遂に言葉にする。,"he finally put into words.","наконец было облечено в слова."
phrase369,マリア。,"Maria.","Мария."
phrase370,俺の傍にいてほしい。,"I want you by my side.","Я хочу, чтобы ты была рядом со мной."
phrase371,これからも、ずっと。,"Now and forever.","Теперь и всегда."
phrase372,飾らない言葉。,"Simple words.","Простые слова."
phrase373,どこまでもシンプルで,"So simple,","Такие простые,"
phrase374,真っ直ぐな想い。,"yet so sincere.","но такие искренние."
phrase375,マリアはアランを見つめた。,"Maria gazed at Alan.","Мария смотрела на Алана."
phrase376,それがどういうことか,"Did he understand what that meant?","Понимает ли он, что это значит?"
phrase377,アラン様は、ご理解の上ですか？,"Do you understand what you're asking, Prince Alan?","Понимаете ли вы, что вы просите, Алан-сама?"
phrase378,わかってる。,"I understand.","Да, понимаю."
phrase379,……俺のものになってくれ。,"...Be mine.","...Стань моей."
phrase380,俺と――結婚してくれ。,"Marry me.","Выходи за меня."
phrase381,かつてない、アランの真面目な眼差し。,"Alan's gaze had never been so serious.","Никогда прежде взгляд Алана не был таким серьёзным."
phrase382,彼は言葉を続けた。,"He continued speaking.","Он продолжил говорить."
phrase383,昨日、メアリとジオルドに,"Yesterday, I talked to Mary and Geordo,","Вчера я поговорил с Мэри и Джордо,"
phrase384,話をつけてきた。両方の親ともだ。,"and with both of our parents.","а также с нашими родителями."
phrase385,しっかりと話し合った。,"We had a serious conversation.","Мы серьёзно обсудили всё."
phrase386,……二人共,"And both of them","И они оба"
phrase387,俺の背中を押してくれた。,"gave me their blessing.","дали мне своё благословение."
phrase388,（だから、メアリ様は――）,"(So that's why Lady Mary...)","(Вот почему леди Мэри...)"
phrase389,マリアは先ほどの邂逅を思い出す。,"Maria recalled their encounter earlier.","Мария вспомнила их недавнюю встречу."
phrase390,同時に、託された想いを噛み締める。,"At the same time, she realized what had been entrusted to her.","И в то же время она осознала, что было доверено ей."
phrase391,アランも、メアリも,"Both Alan and Mary","И Алан, и Мэри"
phrase392,覚悟を決めたのだ。,"had made up their minds.","приняли своё решение."
phrase393,アランはかしずき、マリアを見上げる。,"Alan knelt down and looked up at Maria.","Алан встал на колено и посмотрел на Марию."
phrase394,（なんて答えよう？）,"(How should I answer?)","(Как мне ответить?)"
text395,喜んで,"With pleasure.","С радостью."
text396,本当にいいんですか？,"Are you really sure?","Вы уверены?"
phrase397,大きな声。,"A loud voice.","Громкий голос."
phrase398,大きな想い。,"Big feelings.","Сильные чувства."
phrase399,マリアは受け止める覚悟を決める。,"Maria was ready to accept them.","Мария была готова принять их."
phrase400,それが自分を応援してくれている人たち。,"Because those were the people who supported her.","Ведь эти чувства исходили от людей, которые её поддерживали."
phrase401,そして自分の恋心への,"And they were her respect","И это был её способ уважить"
phrase402,最大の敬意と誠意なのだから。,"and deepest sincerity for her own feelings of love.","и отдать должное своим собственным чувствам любви."
phrase403,――喜んで。,"—With pleasure.","—С радостью."
phrase404,私の全てを、あなたにさしあげます。,"I'll give you all of myself.","Я отдаю вам всю себя."
